{
  "updated_at": "2026-03-31T00:00:00Z",
  "project": {
    "name": "Boom Antigravity Kit",
    "description": "The next-generation autonomous engineering toolkit.",
    "type": "library",
    "status": "production",
    "repository": "https://github.com/vudovn/antigravity-kit"
  },
  "tech_stack": {
    "frontend": {},
    "backend": {},
    "database": {},
    "infrastructure": {}
  },
  "features": [],
  "api_endpoints": []
}
